{"catalog_digest":"sha256:36b6119324d0607f0601737bc44f92b0ae9e9d41a3109f8498ec7128ab00a222","expires_at":"2026-07-19T15:30:31.045Z","generated_at":"2026-07-12T15:30:31.045Z","manifest_digest":"sha256:a0d1ffedc8fb15dfc209d9c6d14b518e3d567183a047f05aa8df57074bd20bd7","records":[{"command_id":"cc-b4-b6-red","duration_ms":1311,"environment_digest":"sha256:ffc971f3772ba83df04cc89156ca538687b5420b8e6df6fe4daba7b32a526023","exit_code":1,"expected_exit":"nonzero","manifest_digest":"sha256:a0d1ffedc8fb15dfc209d9c6d14b518e3d567183a047f05aa8df57074bd20bd7","output_digest":"sha256:31513b9d347bcc33f2f993d8937165371832d3f438bd4c74f99bc26c51e52b53","output_excerpt":"[2026-07-12T15:30:32.503Z] [WARN ] Running without TLS - only use for local development [2026-07-12T15:30:32.506Z] [INFO ] CC Gateway listening on http://:::52377 [2026-07-12T15:30:32.507Z] [INFO ] Upstream: http://127.0.0.1:52375 [2026-07-12T15:30:32.507Z] [INFO ] Canonical device_id: aaaaaaaa... [2026-07-12T15:30:32.507Z] [INFO ] Authorized clients:  [2026-07-12T15:30:32.511Z] [INFO ] ← POST /v1/messages?beta=<redacted> from ::1 [2026-07-12T15:30:32.512Z] [INFO ] Client \"gateway\" → POST /v1/messages?beta=<redacted> [2026-07-12T15:30:32.566Z] [INFO ] Using proxy agent {\"cacheKeyRef\":\"omitted_by_policy\",\"proxyRef\":\"omitted_by_policy\"} ✔ HA-P0-009 positive compatibility baseline reaches local upstream (90.116875ms) [2026-07-12T15:30:32.586Z] [WARN ] Running without TLS - only use for local development [2026-07-12T15:30:32.587Z] [INFO ] CC Gateway listening on http://:::52383 [2026-07-12T15:30:32.587Z] [INFO ] Upstream: http://127.0.0.1:52381 [2026-07-12T15:30:32.587Z] [INFO ] Canonical device_id: aaaaaaaa... [2026-07-12T15:30:32.587Z] [INFO ] Authorized clients:  [2026-07-12T15:30:32.587Z] [INFO ] ← POST /v1/messages?beta=<redacted> from ::1 [2026-07-12T15:30:32.587Z] [INFO ] Client \"gateway\" → POST /v1/messages?beta=<redacted> [2026-07-12T15:30:32.588Z] [INFO ] Using proxy agent {\"cacheKeyRef\":\"omitted_by_policy\",\"proxyRef\":\"omitted_by_policy\"} ✖ HA-P0-009 rejects missing negative-capability declaration (5.729292ms) [2026-07-12T15:30:32.592Z] [WARN ] Running without TLS - only use for local development [2026-07-12T15:30:32.592Z] [INFO ] CC Gateway listening on http://:::52389 [2026-07-12T15:30:32.592Z] [INFO ] Upstream: http://127.0.0.1:52387 [2026-07-12T15:30:32.592Z] [INFO ] Canonical device_id: aaaaaaaa... [2026-07-12T15:30:32.592Z] [INFO ] Authorized clients:  [2026-07-12T15:30:32.592Z] [INFO ] ← POST /v1/messages?beta=<redacted> from ::1 [2026-07-12T15:30:32.593Z] [INFO ] Client \"gateway\" → POST /v1/messages?beta=<redacted> [2026-07-12T15:30:32.594Z] [INFO ] Using proxy agent {\"cacheKeyRef\":\"omitted_by_polic","repository":"cc-gateway","repository_commit":"414c520f1e06120275c0b4a2f9c6879ba640604e","result_digest":"sha256:6fa1e8f29490fc98d0559fb55a5fdbae6f26bf4a868654914fcf3fd52f27709c","status":"expected_fail"},{"command_id":"sidecar-b4-b6-red","duration_ms":2286,"environment_digest":"sha256:ffc971f3772ba83df04cc89156ca538687b5420b8e6df6fe4daba7b32a526023","exit_code":1,"expected_exit":"nonzero","manifest_digest":"sha256:a0d1ffedc8fb15dfc209d9c6d14b518e3d567183a047f05aa8df57074bd20bd7","output_digest":"sha256:64079ff919c2f720cc99f86072f61f43d69d7f918190b9ff395b69e5d4032825","output_excerpt":"--- FAIL: TestPhase0B5ControlRequiresCompleteV2Envelope (0.00s)     phase0_red_test.go:13: complete v2 control must be understood before authentication: forbidden control key \"attempt_id\" --- FAIL: TestPhase0B5ControlRejectsLegacyIncompleteControl (0.00s)     phase0_red_test.go:22: legacy control without nonce, freshness, final hashes, and envelope metadata was accepted FAIL FAIL\tcc-gateway/egress-tls-sidecar/internal/control\t0.617s --- FAIL: TestPhase0B5RejectsLegacyPartialProxyBinding (0.00s)     phase0_red_test.go:25: legacy v1 partial proxy binding remains an accepted sidecar authentication boundary --- FAIL: TestPhase0B5BindingRejectsEveryControlMutation (0.00s)     --- FAIL: TestPhase0B5BindingRejectsEveryControlMutation/method (0.00s)         phase0_red_test.go:49: captured authentication accepted mutated method     --- FAIL: TestPhase0B5BindingRejectsEveryControlMutation/profile_ref (0.00s)         phase0_red_test.go:49: captured authentication accepted mutated profile_ref     --- FAIL: TestPhase0B5BindingRejectsEveryControlMutation/expected_tls_summary_bucket (0.00s)         phase0_red_test.go:49: captured authentication accepted mutated expected_tls_summary_bucket     --- FAIL: TestPhase0B5BindingRejectsEveryControlMutation/target_path (0.00s)         phase0_red_test.go:49: captured authentication accepted mutated target_path     --- FAIL: TestPhase0B5BindingRejectsEveryControlMutation/route (0.00s)         phase0_red_test.go:49: captured authentication accepted mutated route     --- FAIL: TestPhase0B5BindingRejectsEveryControlMutation/target_scheme (0.00s)         phase0_red_test.go:49: captured authentication accepted mutated target_scheme --- FAIL: TestPhase0B5ReplayRejectedAfterCompletionRestartAndReplicaChange (0.01s)     --- FAIL: TestPhase0B5ReplayRejectedAfterCompletionRestartAndReplicaChange/same_instance_after_successful_completion (0.00s)         phase0_red_test.go:90: captured request replay status = 200, want 403 (same handler and ledger)     --- FAIL: TestPhase0B5ReplayRejectedAfterComplet","repository":"egress-tls-sidecar","repository_commit":"414c520f1e06120275c0b4a2f9c6879ba640604e","result_digest":"sha256:97360bdfd1c9f8588966bb305718f3c664158635651e1c52b657a8477e17965f","status":"expected_fail"},{"command_id":"sub2api-b1-b3-red","contract_digest":"sha256:70c26db06e9135db31d08f097573e3fd55bd9a8894614832eefeecabf6b1a3d1","duration_ms":66375,"environment_digest":"sha256:ffc971f3772ba83df04cc89156ca538687b5420b8e6df6fe4daba7b32a526023","exit_code":1,"expected_exit":"nonzero","manifest_digest":"sha256:a0d1ffedc8fb15dfc209d9c6d14b518e3d567183a047f05aa8df57074bd20bd7","output_digest":"sha256:4e3de25766b7dcd42d3185d45db8d257f5e7ffabb2d670d2772e41e26b42861c","output_excerpt":"--- FAIL: TestFormalPoolBrowserEgressAttestationRejectsUntrustedProofs (0.00s)     --- FAIL: TestFormalPoolBrowserEgressAttestationRejectsUntrustedProofs/arbitrary_non-empty_code (0.00s)         formal_pool_onboarding_phase0_red_test.go:49:              \tError Trace:\t[REDACTED_PATH]             \tError:      \tAn error is expected but got nil.             \tTest:       \tTestFormalPoolBrowserEgressAttestationRejectsUntrustedProofs/arbitrary_non-empty_code             \tMessages:   \tclient-chosen text must not attest browser egress     --- FAIL: TestFormalPoolBrowserEgressAttestationRejectsUntrustedProofs/wrong_server_proof (0.00s)         formal_pool_onboarding_phase0_red_test.go:55:              \tError Trace:\t[REDACTED_PATH]             \tError:      \tAn error is expected but got nil.             \tTest:       \tTestFormalPoolBrowserEgressAttestationRejectsUntrustedProofs/wrong_server_proof             \tMessages:   \ta modified server proof must be rejected     --- FAIL: TestFormalPoolBrowserEgressAttestationRejectsUntrustedProofs/expired_server_proof (0.00s)         formal_pool_onboarding_phase0_red_test.go:62:              \tError Trace:\t[REDACTED_PATH]             \tError:      \tAn error is expected but got nil.             \tTest:       \tTestFormalPoolBrowserEgressAttestationRejectsUntrustedProofs/expired_server_proof             \tMessages:   \tan expired server proof must be rejected     --- FAIL: TestFormalPoolBrowserEgressAttestationRejectsUntrustedProofs/cross-session_server_proof (0.00s)         formal_pool_onboarding_phase0_red_test.go:77:              \tError Trace:\t[REDACTED_PATH]             \tError:      \tAn error is expected but got nil.             \tTest:       \tTestFormalPoolBrowserEgressAttestationRejectsUntrustedProofs/cross-session_server_proof             \tMessages:   \tproofs must be bound to exactly one onboarding session     --- FAIL: TestFormalPoolBrowserEgressAttestationRejectsUntrustedProofs/proof_minted_before_proxy_change (0.00s)         formal_pool_onboarding_phase0_red_test.go:85:              \tEr","repository":"sub2api","repository_commit":"d5a42bbd24d15af2ce7646d050a5ae5c77911d4f","result_digest":"sha256:70ace14f0fb364e150d56cccdf891f34e051dee87a520acda7601edb46445f60","status":"expected_fail"}],"result_set_digest":"sha256:b60216020fb629ea58e6489c00ed6519db8ca79b9043042261cfb9e887a6dc2a","schema_version":1}
