{"catalog_digest":"sha256:709a2e0952b3fc40fba771ffc2e2766d6245722dbc5cf833ca815a9fb0685ef4","expires_at":"2026-07-19T17:02:55.551Z","generated_at":"2026-07-12T17:02:55.551Z","manifest_digest":"sha256:7670881a6a1d311a1fc47d9be3f7612ed082ebc6a60ccbc89ce100dbae54cb81","records":[{"command_id":"cc-b4-b6-red","duration_ms":999,"environment_digest":"sha256:21f99d760b302171d23e6d3aa736a73e9c2cb5ca8c18388196bce94e8626357b","exit_code":1,"expected_exit":"nonzero","manifest_digest":"sha256:7670881a6a1d311a1fc47d9be3f7612ed082ebc6a60ccbc89ce100dbae54cb81","output_digest":"sha256:151cdf67e5990e120bdf66d7305611806d7de8a7ac8b8a4895216e4741339cda","output_excerpt":"[2026-07-12T17:02:57.031Z] [WARN ] Running without TLS - only use for local development [2026-07-12T17:02:57.033Z] [INFO ] CC Gateway listening on http://:::58597 [2026-07-12T17:02:57.034Z] [INFO ] Upstream: http://127.0.0.1:58595 [2026-07-12T17:02:57.034Z] [INFO ] Canonical device_id: aaaaaaaa... [2026-07-12T17:02:57.034Z] [INFO ] Authorized clients:  [2026-07-12T17:02:57.038Z] [INFO ] ← POST /v1/messages?beta=<redacted> from ::1 [2026-07-12T17:02:57.039Z] [INFO ] Client \"gateway\" → POST /v1/messages?beta=<redacted> [2026-07-12T17:02:57.079Z] [INFO ] Using proxy agent {\"cacheKeyRef\":\"omitted_by_policy\",\"proxyRef\":\"omitted_by_policy\"} ✔ HA-P0-009 positive compatibility baseline reaches local upstream (75.35925ms) [2026-07-12T17:02:57.098Z] [WARN ] Running without TLS - only use for local development [2026-07-12T17:02:57.099Z] [INFO ] CC Gateway listening on http://:::58603 [2026-07-12T17:02:57.099Z] [INFO ] Upstream: http://127.0.0.1:58601 [2026-07-12T17:02:57.099Z] [INFO ] Canonical device_id: aaaaaaaa... [2026-07-12T17:02:57.099Z] [INFO ] Authorized clients:  [2026-07-12T17:02:57.100Z] [INFO ] ← POST /v1/messages?beta=<redacted> from ::1 [2026-07-12T17:02:57.100Z] [INFO ] Client \"gateway\" → POST /v1/messages?beta=<redacted> [2026-07-12T17:02:57.101Z] [INFO ] Using proxy agent {\"cacheKeyRef\":\"omitted_by_policy\",\"proxyRef\":\"omitted_by_policy\"} ✖ HA-P0-009 rejects missing negative-capability declaration (7.43675ms) [2026-07-12T17:02:57.106Z] [WARN ] Running without TLS - only use for local development [2026-07-12T17:02:57.106Z] [INFO ] CC Gateway listening on http://:::58609 [2026-07-12T17:02:57.106Z] [INFO ] Upstream: http://127.0.0.1:58607 [2026-07-12T17:02:57.106Z] [INFO ] Canonical device_id: aaaaaaaa... [2026-07-12T17:02:57.106Z] [INFO ] Authorized clients:  [2026-07-12T17:02:57.107Z] [INFO ] ← POST /v1/messages?beta=<redacted> from ::1 [2026-07-12T17:02:57.107Z] [INFO ] Client \"gateway\" → POST /v1/messages?beta=<redacted> [2026-07-12T17:02:57.108Z] [INFO ] Using proxy agent {\"cacheKeyRef\":\"omitted_by_policy\"","repository":"cc-gateway","repository_commit":"b38198763ab7e337321e3a0d9e545375d3fb3ad0","result_digest":"sha256:6d64b8992f3f08232437ae07942627e22988e7870cf942d080a436bfce8006c2","status":"expected_fail"},{"command_id":"sidecar-b4-b6-red","duration_ms":2258,"environment_digest":"sha256:21f99d760b302171d23e6d3aa736a73e9c2cb5ca8c18388196bce94e8626357b","exit_code":1,"expected_exit":"nonzero","manifest_digest":"sha256:7670881a6a1d311a1fc47d9be3f7612ed082ebc6a60ccbc89ce100dbae54cb81","output_digest":"sha256:d5cf37388d3bcf27bba3fe7879c2c07bf1388fcbc0d3d55ad493ba2f892393fb","output_excerpt":"--- FAIL: TestPhase0B5ControlRequiresCompleteV2Envelope (0.00s)     phase0_red_test.go:13: complete v2 control must be understood before authentication: forbidden control key \"request_body_hash\" --- FAIL: TestPhase0B5ControlRejectsLegacyIncompleteControl (0.00s)     phase0_red_test.go:22: legacy control without nonce, freshness, final hashes, and envelope metadata was accepted FAIL FAIL\tcc-gateway/egress-tls-sidecar/internal/control\t0.598s --- FAIL: TestPhase0B5RejectsLegacyPartialProxyBinding (0.00s)     phase0_red_test.go:25: legacy v1 partial proxy binding remains an accepted sidecar authentication boundary --- FAIL: TestPhase0B5BindingRejectsEveryControlMutation (0.00s)     --- FAIL: TestPhase0B5BindingRejectsEveryControlMutation/expected_tls_summary_bucket (0.00s)         phase0_red_test.go:49: captured authentication accepted mutated expected_tls_summary_bucket     --- FAIL: TestPhase0B5BindingRejectsEveryControlMutation/target_scheme (0.00s)         phase0_red_test.go:49: captured authentication accepted mutated target_scheme     --- FAIL: TestPhase0B5BindingRejectsEveryControlMutation/target_path (0.00s)         phase0_red_test.go:49: captured authentication accepted mutated target_path     --- FAIL: TestPhase0B5BindingRejectsEveryControlMutation/route (0.00s)         phase0_red_test.go:49: captured authentication accepted mutated route     --- FAIL: TestPhase0B5BindingRejectsEveryControlMutation/method (0.00s)         phase0_red_test.go:49: captured authentication accepted mutated method     --- FAIL: TestPhase0B5BindingRejectsEveryControlMutation/profile_ref (0.00s)         phase0_red_test.go:49: captured authentication accepted mutated profile_ref --- FAIL: TestPhase0B5ReplayRejectedAfterCompletionRestartAndReplicaChange (0.01s)     --- FAIL: TestPhase0B5ReplayRejectedAfterCompletionRestartAndReplicaChange/same_instance_after_successful_completion (0.00s)         phase0_red_test.go:90: captured request replay status = 200, want 403 (same handler and ledger)     --- FAIL: TestPhase0B5ReplayRejectedAfter","repository":"egress-tls-sidecar","repository_commit":"b38198763ab7e337321e3a0d9e545375d3fb3ad0","result_digest":"sha256:975aa28ef678b0bf924c224431384ded2ade3c60627503747128fc2a9b227557","status":"expected_fail"},{"command_id":"sub2api-b1-b3-red","contract_digest":"sha256:70c26db06e9135db31d08f097573e3fd55bd9a8894614832eefeecabf6b1a3d1","duration_ms":13166,"environment_digest":"sha256:21f99d760b302171d23e6d3aa736a73e9c2cb5ca8c18388196bce94e8626357b","exit_code":1,"expected_exit":"nonzero","manifest_digest":"sha256:7670881a6a1d311a1fc47d9be3f7612ed082ebc6a60ccbc89ce100dbae54cb81","output_digest":"sha256:4a56ad8846963958ba05a2e5131a51030c9a43fb0408255f0fb51b3bc045d780","output_excerpt":"--- FAIL: TestFormalPoolBrowserEgressAttestationRejectsUntrustedProofs (0.00s)     --- FAIL: TestFormalPoolBrowserEgressAttestationRejectsUntrustedProofs/arbitrary_non-empty_code (0.00s)         formal_pool_onboarding_phase0_red_test.go:49:              \tError Trace:\t[REDACTED_PATH]             \tError:      \tAn error is expected but got nil.             \tTest:       \tTestFormalPoolBrowserEgressAttestationRejectsUntrustedProofs/arbitrary_non-empty_code             \tMessages:   \tclient-chosen text must not attest browser egress     --- FAIL: TestFormalPoolBrowserEgressAttestationRejectsUntrustedProofs/wrong_server_proof (0.00s)         formal_pool_onboarding_phase0_red_test.go:55:              \tError Trace:\t[REDACTED_PATH]             \tError:      \tAn error is expected but got nil.             \tTest:       \tTestFormalPoolBrowserEgressAttestationRejectsUntrustedProofs/wrong_server_proof             \tMessages:   \ta modified server proof must be rejected     --- FAIL: TestFormalPoolBrowserEgressAttestationRejectsUntrustedProofs/expired_server_proof (0.00s)         formal_pool_onboarding_phase0_red_test.go:62:              \tError Trace:\t[REDACTED_PATH]             \tError:      \tAn error is expected but got nil.             \tTest:       \tTestFormalPoolBrowserEgressAttestationRejectsUntrustedProofs/expired_server_proof             \tMessages:   \tan expired server proof must be rejected     --- FAIL: TestFormalPoolBrowserEgressAttestationRejectsUntrustedProofs/cross-session_server_proof (0.00s)         formal_pool_onboarding_phase0_red_test.go:77:              \tError Trace:\t[REDACTED_PATH]             \tError:      \tAn error is expected but got nil.             \tTest:       \tTestFormalPoolBrowserEgressAttestationRejectsUntrustedProofs/cross-session_server_proof             \tMessages:   \tproofs must be bound to exactly one onboarding session     --- FAIL: TestFormalPoolBrowserEgressAttestationRejectsUntrustedProofs/proof_minted_before_proxy_change (0.00s)         formal_pool_onboarding_phase0_red_test.go:85:              \tEr","repository":"sub2api","repository_commit":"d5a42bbd24d15af2ce7646d050a5ae5c77911d4f","result_digest":"sha256:3abe3641a3fcccacb8508e7fe20f73b0befa3a135172bfe0bd9db958ec8e90ad","status":"expected_fail"}],"result_set_digest":"sha256:cd3bd7f852ee359c156a9725d4422f8f8daf67c67d08e60cb881d1b546873e92","schema_version":1}
