{"catalog_digest":"sha256:709a2e0952b3fc40fba771ffc2e2766d6245722dbc5cf833ca815a9fb0685ef4","expires_at":"2026-07-19T17:01:30.050Z","generated_at":"2026-07-12T17:01:30.050Z","manifest_digest":"sha256:7670881a6a1d311a1fc47d9be3f7612ed082ebc6a60ccbc89ce100dbae54cb81","records":[{"command_id":"cc-build","duration_ms":2108,"environment_digest":"sha256:21f99d760b302171d23e6d3aa736a73e9c2cb5ca8c18388196bce94e8626357b","exit_code":0,"expected_exit":0,"manifest_digest":"sha256:7670881a6a1d311a1fc47d9be3f7612ed082ebc6a60ccbc89ce100dbae54cb81","output_digest":"sha256:b11b6962204338bad11f1e27e35e249bf4af2c548c448ffacd20d142a168210e","repository":"cc-gateway","repository_commit":"b38198763ab7e337321e3a0d9e545375d3fb3ad0","result_digest":"sha256:fa693ab844ab42c179c089707c46f7f18c99ad6ef8994b701b10b8203c2219fa","status":"pass"},{"command_id":"cc-test","duration_ms":36815,"environment_digest":"sha256:21f99d760b302171d23e6d3aa736a73e9c2cb5ca8c18388196bce94e8626357b","exit_code":0,"expected_exit":0,"manifest_digest":"sha256:7670881a6a1d311a1fc47d9be3f7612ed082ebc6a60ccbc89ce100dbae54cb81","output_digest":"sha256:06e393624b3ce79914951fab7c8aa0f5cb8846e5ce10dd664a1f062d4378f9a0","repository":"cc-gateway","repository_commit":"b38198763ab7e337321e3a0d9e545375d3fb3ad0","result_digest":"sha256:778598666800b862f1178644b59c0e69b6d05d4e7f9c5ee00410cf9a51ef41e5","status":"pass"},{"command_id":"cc-cross-repo-baseline","duration_ms":6979,"environment_digest":"sha256:e337112db7dde9b9bf7b979fb589b70b5cdbce3ea1f5a6c541c31f6d7f845d9c","exit_code":0,"expected_exit":0,"manifest_digest":"sha256:7670881a6a1d311a1fc47d9be3f7612ed082ebc6a60ccbc89ce100dbae54cb81","output_digest":"sha256:2b2ee1b2d964874e540f10974acb2a8452165b7ddbec2caab709aff95edb164f","repository":"cc-gateway","repository_commit":"b38198763ab7e337321e3a0d9e545375d3fb3ad0","result_digest":"sha256:af09e9e5f8d3c9aba00cc1ac0410a4afeeac3d3c5b2a9c7b5b098172829a5e30","status":"pass"},{"command_id":"sidecar-test","duration_ms":4210,"environment_digest":"sha256:21f99d760b302171d23e6d3aa736a73e9c2cb5ca8c18388196bce94e8626357b","exit_code":0,"expected_exit":0,"manifest_digest":"sha256:7670881a6a1d311a1fc47d9be3f7612ed082ebc6a60ccbc89ce100dbae54cb81","output_digest":"sha256:0ab328dae5ad83d679a8aeb2a45d5fc6893412fcd6c6929404106d1827f57ee8","repository":"egress-tls-sidecar","repository_commit":"b38198763ab7e337321e3a0d9e545375d3fb3ad0","result_digest":"sha256:52b2ab016d2c1d6993bd403b045e2444b81a428bc63ece19d41ca3acc5ee0b74","status":"pass"},{"command_id":"sub2api-test","contract_digest":"sha256:70c26db06e9135db31d08f097573e3fd55bd9a8894614832eefeecabf6b1a3d1","duration_ms":10983,"environment_digest":"sha256:21f99d760b302171d23e6d3aa736a73e9c2cb5ca8c18388196bce94e8626357b","exit_code":0,"expected_exit":0,"manifest_digest":"sha256:7670881a6a1d311a1fc47d9be3f7612ed082ebc6a60ccbc89ce100dbae54cb81","output_digest":"sha256:4513f297e8f91144b4a76bf20fb4672aafcb6026a44c9634f57d67ac1a621843","repository":"sub2api","repository_commit":"d5a42bbd24d15af2ce7646d050a5ae5c77911d4f","result_digest":"sha256:c7085c53c0eda805de7fc0281f752e6864c66e22e980601b0322eaeaaa363f2e","status":"pass"}],"result_set_digest":"sha256:5e5ab571d62ec673464fa337ee2e7f26214dfab6550ebff3ce8c269284e362c5","schema_version":1}
