{"catalog_digest":"sha256:36b6119324d0607f0601737bc44f92b0ae9e9d41a3109f8498ec7128ab00a222","expires_at":"2026-07-19T15:29:01.720Z","generated_at":"2026-07-12T15:29:01.720Z","manifest_digest":"sha256:a0d1ffedc8fb15dfc209d9c6d14b518e3d567183a047f05aa8df57074bd20bd7","records":[{"command_id":"cc-build","duration_ms":1978,"environment_digest":"sha256:ffc971f3772ba83df04cc89156ca538687b5420b8e6df6fe4daba7b32a526023","exit_code":0,"expected_exit":0,"manifest_digest":"sha256:a0d1ffedc8fb15dfc209d9c6d14b518e3d567183a047f05aa8df57074bd20bd7","output_digest":"sha256:b11b6962204338bad11f1e27e35e249bf4af2c548c448ffacd20d142a168210e","repository":"cc-gateway","repository_commit":"414c520f1e06120275c0b4a2f9c6879ba640604e","result_digest":"sha256:04995e4e240a8a3839586d84f70c20c76f4d9cdce417bcc83c8414a9620dfb63","status":"pass"},{"command_id":"cc-test","duration_ms":44972,"environment_digest":"sha256:ffc971f3772ba83df04cc89156ca538687b5420b8e6df6fe4daba7b32a526023","exit_code":0,"expected_exit":0,"manifest_digest":"sha256:a0d1ffedc8fb15dfc209d9c6d14b518e3d567183a047f05aa8df57074bd20bd7","output_digest":"sha256:d74a871f642e505289d87dbe9093445ee9ace2b298ed65711ed930dce7771f46","repository":"cc-gateway","repository_commit":"414c520f1e06120275c0b4a2f9c6879ba640604e","result_digest":"sha256:ae58b8f1c5bd123c7d13a468780de2ded97060defded72c2e96c057c5ac9e154","status":"pass"},{"command_id":"sidecar-test","duration_ms":4407,"environment_digest":"sha256:ffc971f3772ba83df04cc89156ca538687b5420b8e6df6fe4daba7b32a526023","exit_code":0,"expected_exit":0,"manifest_digest":"sha256:a0d1ffedc8fb15dfc209d9c6d14b518e3d567183a047f05aa8df57074bd20bd7","output_digest":"sha256:245210a3a67f6ff980bc070526f8460fb971a46bf9f39f3ed2d4c0106e5331a0","repository":"egress-tls-sidecar","repository_commit":"414c520f1e06120275c0b4a2f9c6879ba640604e","result_digest":"sha256:df249c0a5acc60637f7d4f5e522bbbed6a3a6133b17008cce7f06a4365d480c0","status":"pass"},{"command_id":"sub2api-test","contract_digest":"sha256:70c26db06e9135db31d08f097573e3fd55bd9a8894614832eefeecabf6b1a3d1","duration_ms":11949,"environment_digest":"sha256:ffc971f3772ba83df04cc89156ca538687b5420b8e6df6fe4daba7b32a526023","exit_code":0,"expected_exit":0,"manifest_digest":"sha256:a0d1ffedc8fb15dfc209d9c6d14b518e3d567183a047f05aa8df57074bd20bd7","output_digest":"sha256:55c3c31f5f9c101ab0bcf7af14c555a5c6e3fd4e5b35db99f98ff4de4ecf6934","repository":"sub2api","repository_commit":"d5a42bbd24d15af2ce7646d050a5ae5c77911d4f","result_digest":"sha256:d7a51b1f6e1abe456e37fd2e89183f3ab0ac4fad53533031187f96900473d6f2","status":"pass"}],"result_set_digest":"sha256:a7f5c7eb71ef81e41591c73bec1e19f2c8ea8ab79a1bc20f10fbf03f7305bcc9","schema_version":1}
